{
  "requestId": "req-20260804-0004",
  "snapshotId": "snapshot-0001",
  "snapshotCursor": "100",
  "items": [
    {
      "entityType": "execution.task",
      "entityId": "task-2026-08-04-0001",
      "serverVersion": "42",
      "payload": {
        "meta": {
          "id": "task-2026-08-04-0001",
          "userId": "local-user",
          "createdAt": "2026-08-04T15:29:00Z",
          "updatedAt": "2026-08-04T15:30:05Z",
          "deletedAt": null,
          "localVersion": 2,
          "serverVersion": "42",
          "modifiedByDevice": "11111111-1111-4111-8111-111111111111"
        },
        "title": "Example task",
        "estimatedMinutes": 125,
        "status": "todo"
      }
    }
  ],
  "nextPageToken": "page-1",
  "completed": false,
  "serverTime": "2026-08-04T15:33:00Z"
}
